{"schema_version":"ai-film-studio/PromptPacket/v1","id":"prompt_example_arrival_001","shot_record_id":"shot_example_arrival_001","shot_record_sha256":"0000000000000000000000000000000000000000000000000000000000000000","model_profile_id":"seedance-2.5","model_profile_version":"1.0.0","status":"delegated","format_owner":"video-production-studio:video-prompt-builder","normalized_shot_record":{"purpose":"Show recognition before speech."},"compiled_prompt":"","validator_result":{"status":"delegated","validator":"video-production-studio:video-prompt-builder","evidence":[]},"source_references":[{"path":"records/shot_example_arrival_001.json","sha256":"0000000000000000000000000000000000000000000000000000000000000000"}],"prompt_sha256":"","external_action_policy":"approval-required"}
